beam_id,title,category_main_group,category_sub_group,category,categories,address,street,city,state,borough,neighborhood,postal_code,country,address_verified,latitude,longitude,timezone,phone,price_level,business_status,has_open_hours,has_price,census_place,verified_census_city,beam_location_name,beam_state_code,beam_country_code,website_protocol,website,website_normalized,website_domain,website_domain_tld,website_domain_age,website_domain_registered,website_domain_expires,website_domain_registrar,emails_list,emails_list_website_domain,emails_count,emails_deliverable_count,emails_risky_count,description,has_about,has_description,rating,reviews_total_count,reviews_per_rating,service_options,highlights,popular_for,accessibility,offerings,dining_options,amenities,atmosphere,crowd,planning,payments,children,has_popular_times,has_website,has_email,has_social,has_phone,socials_count,first_social_post_date,last_social_post_date,first_social_post_days,last_social_post_days,social_post_count,first_social_post_days_min,first_social_post_days_max,last_social_post_days_min,last_social_post_days_max,social_profile_instagram,social_username_instagram,social_profile_facebook,social_username_facebook,social_profile_twitter,social_username_twitter,social_profile_tiktok,social_username_tiktok,social_profile_linkedin,social_username_linkedin,social_profile_youtube,social_username_youtube,social_profile_github,social_username_github,social_profile_snapchat,social_username_snapchat,social_profile_pinterest,social_username_pinterest,instagram_followers,instagram_engagement_rate,instagram_engagement_rate_1m,instagram_engagement_rate_3m,instagram_engagement_rate_6m,instagram_engagement_rate_12m,instagram_post_count,tiktok_followers,tiktok_video_count,tiktok_heart_count,tiktok_engagement_rate,tiktok_engagement_rate_1m,tiktok_engagement_rate_3m,tiktok_engagement_rate_6m,tiktok_engagement_rate_12m,menu_link,order_links,reservation_link,last_updated_at,beam_cross_social_market_penetration,beam_cross_velocity_quality,beam_cross_social_urgency,beam_cross_per_capita_engagement,beam_cross_market_saturation_lead,beam_cross_population_adjusted_rank,beam_cross_demand_gap_index,beam_rating_score,beam_review_confidence,beam_rating_health,sentiment_avg,sentiment_avg_30d,sentiment_avg_90d,sentiment_avg_180d,sentiment_avg_360d,sentiment_percentile_1km,sentiment_percentile_5km,sentiment_percentile_10km,sentiment_score_90d,sentiment_score_360d,sentiment_positive_pct_30d,sentiment_negative_pct_30d,sentiment_neutral_pct_30d,sentiment_positive_pct_90d,sentiment_negative_pct_90d,sentiment_neutral_pct_90d,sentiment_positive_pct_180d,sentiment_negative_pct_180d,sentiment_neutral_pct_180d,sentiment_positive_pct_360d,sentiment_negative_pct_360d,sentiment_neutral_pct_360d,sentiment_trend_30vs90d,sentiment_trend_90vs360d,sentiment_diff_30vs90d,sentiment_change_360d,sentiment_diff_90vs360d,sentiment_change_pct_360d,reviews_count_30d,reviews_count_90d,reviews_count_180d,reviews_count_360d,review_growth_pct_180d,review_growth_pct_360d,review_growth_pct_90d,beam_score_overall,beam_popularity_percentile,beam_social_presence,beam_data_completeness,beam_price_value,beam_data_freshness,beam_rank_city_category,beam_rank_city_overall,beam_rank_city_reviews,beam_rank_state_category,beam_rank_state_overall,beam_rank_state_reviews,beam_rank_country_category,beam_rank_country_overall,beam_rank_country_reviews,beam_rank_place_global_category,beam_rank_category,beam_rank_competition_1km_category,beam_rank_competition_1km_total,beam_rank_competition_1km_reviews,beam_rank_competition_5km_category,beam_rank_competition_5km_total,beam_rank_competition_5km_reviews,beam_rank_competition_10km_category,beam_rank_competition_10km_total,beam_rank_competition_10km_reviews,beam_export_rank,total_city_category,total_city,total_state_category,total_state,total_country_category,total_country,total_category_global,beam_competitors_10km_competitive_strength,beam_competitors_10km_competitor_avg_sentiment_30d,beam_competitors_10km_competitor_avg_sentiment_90d,beam_competitors_10km_sentiment_diff_30d,beam_competitors_10km_sentiment_diff_90d,beam_competitors_1km_competitive_strength,beam_competitors_1km_competitor_avg_sentiment_30d,beam_competitors_1km_competitor_avg_sentiment_90d,beam_competitors_1km_sentiment_diff_30d,beam_competitors_1km_sentiment_diff_90d,beam_competitors_5km_competitive_strength,beam_competitors_5km_competitor_avg_sentiment_30d,beam_competitors_5km_competitor_avg_sentiment_90d,beam_competitors_5km_sentiment_diff_30d,beam_competitors_5km_sentiment_diff_90d,beam_competitors_10km_competitor_count,beam_competitors_1km_competitor_count,beam_competitors_5km_competitor_count,beam_competitors_1km_rank_by_score,beam_competitors_1km_rank_by_rating,beam_competitors_1km_rank_by_reviews,beam_competitors_1km_score_percentile,beam_competitors_1km_rating_percentile,beam_competitors_1km_reviews_percentile,beam_competitors_1km_health_percentile,beam_competitors_1km_sentiment_percentile,beam_competitors_1km_competitor_avg_score,beam_competitors_1km_competitor_avg_rating,beam_competitors_1km_competitor_avg_reviews,beam_competitors_1km_competitor_avg_health,beam_competitors_1km_competitor_avg_sentiment,beam_competitors_1km_score_diff,beam_competitors_1km_rating_diff,beam_competitors_1km_reviews_diff,beam_competitors_1km_health_diff,beam_competitors_1km_sentiment_diff,beam_competitors_5km_rank_by_score,beam_competitors_5km_rank_by_rating,beam_competitors_5km_rank_by_reviews,beam_competitors_5km_score_percentile,beam_competitors_5km_rating_percentile,beam_competitors_5km_reviews_percentile,beam_competitors_5km_health_percentile,beam_competitors_5km_sentiment_percentile,beam_competitors_5km_competitor_avg_score,beam_competitors_5km_competitor_avg_rating,beam_competitors_5km_competitor_avg_reviews,beam_competitors_5km_competitor_avg_health,beam_competitors_5km_competitor_avg_sentiment,beam_competitors_5km_score_diff,beam_competitors_5km_rating_diff,beam_competitors_5km_reviews_diff,beam_competitors_5km_health_diff,beam_competitors_5km_sentiment_diff,beam_competitors_10km_rank_by_score,beam_competitors_10km_rank_by_rating,beam_competitors_10km_rank_by_reviews,beam_competitors_10km_score_percentile,beam_competitors_1km_competitive_tier,beam_competitors_10km_rating_percentile,beam_competitors_10km_reviews_percentile,beam_competitors_10km_health_percentile,beam_competitors_10km_sentiment_percentile,beam_competitors_5km_competitive_tier,beam_competitors_10km_competitor_avg_score,beam_competitors_10km_competitor_avg_rating,beam_competitors_10km_competitor_avg_reviews,beam_competitors_10km_competitor_avg_health,beam_competitors_10km_competitive_tier,beam_competitors_10km_competitor_avg_sentiment,beam_competitors_10km_score_diff,beam_competitors_10km_rating_diff,beam_competitors_10km_reviews_diff,beam_competitors_10km_health_diff,beam_competitors_10km_sentiment_diff,beam_competitors_1km_total_in_radius,beam_competitors_5km_total_in_radius,beam_competitors_10km_total_in_radius,beam_competitors_1km_avg_distance_m,beam_competitors_1km_closest_competitor_m,beam_competitors_1km_market_type,beam_competitors_1km_review_share,beam_competitors_1km_density_per_sqkm,beam_competitors_1km_tier_below_40,beam_competitors_1km_tier_40_59,beam_competitors_1km_tier_60_79,beam_competitors_1km_tier_80_100,beam_competitors_5km_avg_distance_m,beam_competitors_5km_closest_competitor_m,beam_competitors_5km_market_type,beam_competitors_5km_review_share,beam_competitors_5km_density_per_sqkm,beam_competitors_5km_tier_below_40,beam_competitors_5km_tier_40_59,beam_competitors_5km_tier_60_79,beam_competitors_5km_tier_80_100,beam_competitors_10km_avg_distance_m,beam_competitors_10km_closest_competitor_m,beam_competitors_10km_market_type,beam_competitors_10km_review_share,beam_competitors_10km_density_per_sqkm,beam_competitors_10km_tier_below_40,beam_competitors_10km_tier_40_59,beam_competitors_10km_tier_60_79,beam_competitors_10km_tier_80_100,beam_competitors_city_competitor_avg_sentiment_30d,beam_competitors_city_competitor_avg_sentiment_90d,beam_competitors_city_sentiment_diff_30d,beam_competitors_city_sentiment_diff_90d,beam_competitors_city_competitor_count,beam_competitors_city_total_in_city,beam_competitors_city_rank_by_score,beam_competitors_city_rank_by_rating,beam_competitors_city_rank_by_reviews,beam_competitors_city_score_percentile,beam_competitors_city_rating_percentile,beam_competitors_city_reviews_percentile,beam_competitors_city_health_percentile,beam_competitors_city_sentiment_percentile,beam_competitors_city_competitor_avg_score,beam_competitors_city_competitor_avg_rating,beam_competitors_city_competitor_avg_reviews,beam_competitors_city_competitor_avg_health,beam_competitors_city_competitor_avg_sentiment,beam_competitors_city_score_diff,beam_competitors_city_rating_diff,beam_competitors_city_reviews_diff,beam_competitors_city_health_diff,beam_competitors_city_sentiment_diff,beam_competitors_city_market_type,beam_competitors_city_review_share,beam_competitors_city_density_per_sqkm,beam_competitors_city_tier_below_40,beam_competitors_city_tier_40_59,beam_competitors_city_tier_60_79,beam_competitors_city_tier_80_100,beam_competitors_city_competitive_strength,beam_competitors_city_underserved_score,beam_competitors_city_competition_intensity,beam_competitors_state_competitor_avg_sentiment_30d,beam_competitors_state_competitor_avg_sentiment_90d,beam_competitors_state_sentiment_diff_30d,beam_competitors_state_sentiment_diff_90d,beam_competitors_state_competitor_count,beam_competitors_state_total_in_state,beam_competitors_state_rank_by_score,beam_competitors_state_rank_by_rating,beam_competitors_state_rank_by_reviews,beam_competitors_state_score_percentile,beam_competitors_state_rating_percentile,beam_competitors_state_reviews_percentile,beam_competitors_state_health_percentile,beam_competitors_state_sentiment_percentile,beam_competitors_state_competitor_avg_score,beam_competitors_state_competitor_avg_rating,beam_competitors_state_competitor_avg_reviews,beam_competitors_state_competitor_avg_health,beam_competitors_state_competitor_avg_sentiment,beam_competitors_state_score_diff,beam_competitors_state_rating_diff,beam_competitors_state_reviews_diff,beam_competitors_state_health_diff,beam_competitors_state_sentiment_diff,beam_competitors_state_market_type,beam_competitors_state_review_share,beam_competitors_state_density_per_sqkm,beam_competitors_state_underserved_score,beam_competitors_state_competition_intensity,beam_competitors_state_competitive_strength,beam_competitors_country_competitor_avg_sentiment_30d,beam_competitors_country_competitor_avg_sentiment_90d,beam_competitors_country_sentiment_diff_30d,beam_competitors_country_sentiment_diff_90d,beam_competitors_country_competitor_count,beam_competitors_country_competitor_avg_score,beam_competitors_country_competitor_avg_rating,beam_competitors_country_competitor_avg_reviews,beam_competitors_country_competitor_avg_health,beam_competitors_country_competitor_avg_sentiment,beam_competitors_country_score_diff,beam_competitors_country_rating_diff,beam_competitors_country_reviews_diff,beam_competitors_country_sentiment_diff,beam_competitors_country_score_percentile,beam_competitors_country_rating_percentile,beam_competitors_country_reviews_percentile,beam_competitors_country_health_percentile,beam_competitors_country_sentiment_percentile,beam_competitors_country_rank_by_score,beam_competitors_country_competitive_strength,beam_competitors_country_health_diff,beam_competitors_country_rank_by_rating,beam_competitors_country_rank_by_reviews,beam_competitors_country_tier_40_59,beam_competitors_country_tier_60_79,beam_competitors_country_tier_80_100,beam_competitors_country_tier_below_40,beam_competitors_country_total_in_country,beam_competitors_city_siblings_competitor_count,beam_competitors_city_siblings_competitor_avg_score,beam_competitors_city_siblings_competitor_avg_rating,beam_competitors_city_siblings_competitor_avg_reviews,beam_competitors_city_siblings_competitor_avg_health,beam_competitors_city_siblings_competitor_avg_sentiment,beam_competitors_city_siblings_score_diff,beam_competitors_city_siblings_rating_diff,beam_competitors_city_siblings_reviews_diff,beam_competitors_city_siblings_sentiment_diff,beam_competitors_city_siblings_score_percentile,beam_competitors_city_siblings_rating_percentile,beam_competitors_city_siblings_reviews_percentile,beam_competitors_city_siblings_health_percentile,beam_competitors_city_siblings_sentiment_percentile,beam_competitors_city_siblings_rank_by_score,beam_competitors_city_siblings_competitor_avg_recommend_pct,beam_competitors_city_siblings_recommend_pct_diff,beam_competitors_city_siblings_recommend_pct_percentile,beam_competitors_city_siblings_total_siblings,beam_competitors_city_businesses_per_10k_pop,beam_competitors_city_population_per_business,beam_competitors_city_population_density,beam_competitors_city_reviews_per_capita,beam_competitors_city_reviews_per_10k_pop,beam_competitors_state_businesses_per_10k_pop,beam_competitors_state_population_per_business,beam_competitors_state_population_density,beam_competitors_state_reviews_per_capita,beam_competitors_state_reviews_per_10k_pop,beam_competitors_1km_hhi_contribution,beam_competitors_1km_hhi_minimum,beam_competitors_5km_hhi_contribution,beam_competitors_5km_hhi_minimum,beam_competitors_10km_hhi_contribution,beam_competitors_10km_hhi_minimum,beam_competitors_city_hhi_contribution,beam_competitors_city_hhi_minimum,beam_competitors_state_hhi_contribution,beam_competitors_state_hhi_minimum,beam_trends_score_30d_beam_score_overall,beam_trends_score_30d_rating,beam_trends_score_30d_review_count,beam_trends_score_30d_beam_rating_health,beam_trends_score_30d_beam_popularity_percentile,beam_trends_score_90d_beam_score_overall,beam_trends_score_90d_rating,beam_trends_score_90d_review_count,beam_trends_score_90d_beam_rating_health,beam_trends_score_90d_beam_popularity_percentile,beam_trends_competitive_1km_30d_strength_change,beam_trends_competitive_1km_30d_rank_change,beam_trends_competitive_1km_30d_percentile_change,beam_trends_competitive_1km_90d_strength_change,beam_trends_competitive_1km_90d_rank_change,beam_trends_competitive_1km_90d_percentile_change,beam_trends_competitive_5km_30d_strength_change,beam_trends_competitive_5km_30d_rank_change,beam_trends_competitive_5km_30d_percentile_change,beam_trends_competitive_5km_90d_strength_change,beam_trends_competitive_5km_90d_rank_change,beam_trends_competitive_5km_90d_percentile_change,beam_trends_competitive_10km_30d_strength_change,beam_trends_competitive_10km_30d_rank_change,beam_trends_competitive_10km_30d_percentile_change,beam_trends_competitive_10km_90d_strength_change,beam_trends_competitive_10km_90d_rank_change,beam_trends_competitive_10km_90d_percentile_change,beam_trends_competitive_city_30d_strength_change,beam_trends_competitive_city_30d_rank_change,beam_trends_competitive_city_30d_percentile_change,beam_trends_competitive_city_90d_strength_change,beam_trends_competitive_city_90d_rank_change,beam_trends_competitive_city_90d_percentile_change,beam_trends_competitive_state_30d_strength_change,beam_trends_competitive_state_30d_rank_change,beam_trends_competitive_state_30d_percentile_change,beam_trends_competitive_state_90d_strength_change,beam_trends_competitive_state_90d_rank_change,beam_trends_competitive_state_90d_percentile_change,beam_trends_sentiment_current_sentiment,beam_trends_sentiment_positive_ratio,beam_trends_sentiment_negative_ratio,beam_trends_sentiment_review_count,beam_trends_velocity_reviews_per_day,beam_trends_velocity_reviews_per_month,beam_trends_velocity_percentile_city,beam_trends_velocity_percentile_state,beam_trends_velocity_trend,beam_velocity_reviews_per_day,beam_velocity_reviews_per_week,beam_velocity_reviews_per_month,beam_velocity_reviews_last_30d,beam_velocity_reviews_last_90d,beam_velocity_reviews_last_365d,beam_velocity_percentile_1km,beam_velocity_percentile_5km,beam_velocity_percentile_10km,beam_velocity_percentile_city,beam_velocity_percentile_state,beam_velocity_rank_1km,beam_velocity_rank_5km,beam_velocity_rank_10km,beam_velocity_rank_city,beam_velocity_rank_state,beam_velocity_trend,beam_velocity_change_30d,beam_velocity_change_90d,beam_trends_sentiment_recommend_pct
BD5ZPJDV,Parkside Eats,Food and Drink,Restaurants,Breakfast restaurant,"Breakfast restaurant, Catering food and drink supplier, Restaurant","4323 Montgomery Dr, Santa Rosa, CA 95405",4323 Montgomery Dr,Santa Rosa,California,,,95405,US,True,38.456458399999995,-122.67207909999999,America/Los_Angeles,(707) 80*-****,0,,TRUE,FALSE,,True,Santa Rosa,California,US,,,,,,,,,,,,0,0,0,,FALSE,FALSE,5,0,"{""1"": 0, ""2"": 0, ""3"": 0, ""4"": 0, ""5"": 15}","Takeout, Dine-in",Sports,,,"Alcohol, Beer, Coffee, Comfort food, Vegan options, Vegetarian options, Wine","Breakfast, Brunch, Lunch, Dinner, Catering, Dessert, Seating, Table service",,,Family-friendly,Accepts reservations,"Credit cards, Debit cards","Good for kids, Has changing table(s), High chairs, Kids' menu",FALSE,FALSE,purchase_dataset@,TRUE,TRUE,1,,,,,,,,,,,,,,,,,,,,,,,,,,,,,,,,,,,,,,,,,,,,,,2026-04-17T12:38:41.935016+00:00,,,,,,,,0.0,0.0,50.0,,,,,,,,,,,,,,,,,,,,,,,,,,,,,,,,,,,,24.4,19.5,0,20,50.0,100.0,397,773,773,85762,160355,160355,719756,1454664,1454664,779432,397,,,,,,,,,,292,420,810,90804,170905,763143,1532144,763143,,,,,,,,,,,,,,,,,,,,,,,,,,,,,,,,,,,,,,,,,,,,,,,,,,,,,,,,,,,,,,,,,,,,,,,,,,,,,,,,,,,,,,,,,,,,,,,,,,,,,,,,,,,,,,,,,,,,,,,,,,,,,,,,,,,,,,,,,,,,,,,,,,,,,,,,,,,,,,,,,,,,,,,,,,,,,,,,,,,,,,,,,,,,,,,,,,,,,,,338,64.1,4.33,325,81.0,0.5724,-39.7,,-325,-0.5724,0.0386,0.9466,0.0,0.0089,0.0089,320,73.6,-73.6,0.0,338,,,,,,,,,,,,,,,,,,,,,0.0,,0,0.0,0.0,,,,,,,,,,,,,,,,,,,,,,,,,,,,,,,,,,,,,,,,,,,,,,,,,,,,,,,,,,,,,,,,
CQ35JRKF,Tamales Mana,Food and Drink,Restaurants,Mexican restaurant,"Mexican restaurant, Restaurant, Tamale shop","1110 Petaluma Hill Rd #3, Santa Rosa, CA 95404",1110 Petaluma Hill Rd #3,Santa Rosa,California,South Park,South Park,95404,US,True,38.4272829,-122.70975299999999,America/Los_Angeles,(707) 59*-****,1,,TRUE,TRUE,,True,Santa Rosa,California,US,http,http://tamalesmana.com,tamalesmana.com,tamalesmana.com,com,3090,2017-11-04,2026-11-04,"Wild West Domains, LLC",,,0,0,0,,FALSE,FALSE,4.5,0,"{""1"": 6, ""2"": 7, ""3"": 8, ""4"": 26, ""5"": 137}","Delivery, Onsite services, Takeout",Fast service,"Breakfast, Lunch, Dinner","Wheelchair accessible entrance, Wheelchair accessible parking lot","Comfort food, Quick bite, Small plates","Breakfast, Brunch, Lunch, Dinner, Catering, Counter service, Dessert",,Casual,,,"Credit cards, Debit cards, NFC mobile payments",Good for kids,FALSE,TRUE,purchase_dataset@,TRUE,TRUE,1,,,,,,,,,,,,,,,,,,,,,,,,,,,,,,,,,,,,,,,,,,,,,,2026-04-12T19:43:46.628300+00:00,,,,,,,,0.0,0.0,50.0,,,,,,,,,,,,,,,,,,,,,,,,,,,,,,,,,,,,27.4,19.5,0,50,50.0,90.0,398,778,778,86065,161124,161124,722452,1462778,1462778,782361,398,,,,,,,,,,292,420,810,90804,170905,763143,1532144,763143,,,,,,,,,,,,,,,,,,,,,,,,,,,,,,,,,,,,,,,,,,,,,,,,,,,,,,,,,,,,,,,,,,,,,,,,,,,,,,,,,,,,,,,,,,,,,,,,,,,,,,,,,,,,,,,,,,,,,,,,,,,,,,,,,,,,,,,,,,,,,,,,,,,,,,,,,,,,,,,,,,,,,,,,,,,,,,,,,,,,,,,,,,,,,,,,,,,,,,,338,64.1,4.33,325,81.0,0.5724,-36.7,,-325,-0.5724,0.0593,0.9466,0.0,0.0089,0.0089,316,73.6,-73.6,0.0,338,,,,,,,,,,,,,,,,,,,,,0.0,,0,0.0,0.0,,,,,,,,,,,,,,,,,,,,,,,,,,,,,,,,,,,,,,,,,,,,,,,,,,,,,,,,,,,,,,,,
GMD2MK87,Dave & Buster's Santa Rosa,Food and Drink,Restaurants,Restaurant,"Restaurant, Bar, Video arcade","600 Santa Rosa Plaza, Santa Rosa, CA 95401",600 Santa Rosa Plaza,Santa Rosa,California,,,95401,US,True,38.4393252,-122.7171669,America/Los_Angeles,(707) 32*-****,2,,TRUE,TRUE,,True,Santa Rosa,California,US,https,https://daveandbusters.com/us/en/about/locations/santa-rosa,daveandbusters.com/us/en/about/locations/santa-rosa,daveandbusters.com,com,10361,1997-12-08,2029-12-07,"Network Solutions, LLC",,,0,0,0,Family-friendly chain offering a sports-bar-style setting for American food & arcade games.,TRUE,TRUE,3.4,55,"{""1"": 13, ""2"": 8, ""3"": 5, ""4"": 7, ""5"": 31}","Delivery, Takeout, Dine-in","Fast service, Sports","Lunch, Dinner, Solo dining","Wheelchair accessible entrance, Wheelchair accessible parking lot, Wheelchair accessible restroom, Wheelchair accessible seating","Alcohol, Beer, Cocktails, Coffee, Comfort food, Happy hour drinks, Happy hour food, Hard liquor, Late-night food, Small plates, Wine","Lunch, Dinner, Dessert, Seating, Table service","Bar onsite, Restroom",Casual,Groups,Accepts reservations,"Credit cards, Debit cards","Good for kids, High chairs, Kids' menu",FALSE,TRUE,purchase_dataset@,TRUE,TRUE,1,,,,,,,,,,,,,,,,,,,,,,,,,,,,,,,,,,,,,,,,,,,,https://opentable.com/restaurant/profile/1484977,https://opentable.com/restaurant/profile/1484977,2026-04-11T13:08:48.830989+00:00,0.0,8.78,8.6,3029.13,432.4,62.7329,0.4,68.0,58.3,54.5,0.1258,-0.2701,0.1258,0.1258,0.1258,0.8018,0.7893,0.1246,56.3,56.3,42.86,57.14,0.0,56.36,41.82,1.82,56.36,41.82,1.82,56.36,41.82,1.82,declining,stable,-0.3959,0.0,0.0,0.0,7,55,55,55,100.0,300.0,-61.8,58.8,76.6,0,70,56.3,88.0,327,720,552,64173,144537,105168,547088,1275537,951640,589718,327,150695,64,436441,129235,101,539792,660885,90,703089,278,420,810,90804,170905,763143,1532144,763143,0.1031,0.0415,0.3634,-0.1198,-0.2376,0.6695,0.0809,0.4556,-0.1592,-0.3298,0.6432,0.1366,0.6483,-0.2149,-0.5225,89,63,100,150695,195353,436441,0.7992,0.7368,0.4292,0.8263,0.8018,65.1,4.18,373,83.2,0.5852,-6.3,-0.78,-318,-28.7,-0.4594,129235,195947,539792,0.8295,0.7329,0.3051,0.7398,0.7893,74.3,4.38,462,84.4,0.6636,-15.5,-0.98,-407,-29.9,-0.5378,660885,718164,703089,0.1411,Strong,0.0674,0.088,0.087,0.1246,Average,60.2,3.62,272,73.7,Emerging,0.4583,-1.4,-0.22,-217,-19.2,-0.3325,64,101,90,362,25,competitive,0.0023,20.05,6.3,22.2,61.9,9.5,2968,1085,competitive,0.0012,1.27,0.0,0.0,90.0,10.0,8152,5015,competitive,0.0023,0.28,13.5,18.0,67.4,1.1,0.18,0.7216,-0.2583,-0.5958,100,101,374,442,370,0.1866,0.039,0.1996,0.0998,0.0976,77.2,4.47,540,87.0,0.7206,-18.4,-1.07,-485,-32.5,-0.5948,competitive,0.001,0.9,0.0,0.0,80.0,20.0,0.1462,0.4,4.33,0.4455,0.8838,-0.5238,-0.758,100,101,75905,98831,38759,0.2778,0.0607,0.6313,0.1284,0.1451,85.8,4.68,927,92.7,0.8355,-27.0,-1.28,-872,-38.2,-0.7097,competitive,0.0006,0.0002,2.03,0.02,0.3187,0.0454,0.3033,-0.1237,-0.1775,866631,58.9,3.86,386,76.7,0.4718,-0.1,-0.46,-331,-0.346,0.3651,0.0814,0.2806,0.1513,0.1833,548194,0.2546,-22.2,794325,621847,25.5,57.5,3.0,14.1,866632,338,64.1,4.33,325,81.0,0.5724,-5.3,-0.93,-270,-0.4466,0.2552,0.0237,0.2196,0.0831,0.1009,252,73.6,-17.24,0.178,338,5.61,1781,1610,0.3029,3029.13,0.03,395382,93,0.0023,23.45,0.05,156.25,0.01,99.01,0.05,111.11,0.01,99.01,0.0,99.01,0.0,0.0,0,0.0,0.0,,,,,,0.67,150695,0.799,0.67,150695,0.799,0.64,129235,0.83,0.64,129235,0.83,0.1,660885,0.141,0.1,660885,0.141,0.15,374,0.187,0.15,374,0.187,0.32,75905,0.278,0.32,75905,0.278,0.1258,50.0,50.0,55,1.27,38.0,1.0,0.999,accelerating,1.27,8.87,38.00,38,55,55,0.996,0.996,0.996,1.000,0.999,3788,4057,4071,1,7,accelerating,,,56.36
